<?xml version="1.0" encoding="utf-8" standalone="no"?><webshop xmlns:xs="http://www.w3.org/2001/XMLSchema-instance" xs:noNamespaceSchemaLocation="XMLTaskUY5E1L.xsd">

    <!-- Ügyfelek -->

    <ugyfel ugyfelid="1">
        <nev>
            <vezeteknev>Kovács</vezeteknev>
            <keresztnev>Anna</keresztnev>
        </nev>
        <lakcim>
            <iranyitoszam>1111</iranyitoszam>
            <varos>Budapest</varos>
            <kozterneve>Kossuth út</kozterneve>
            <hazszam>12</hazszam>
        </lakcim>
        <telefonszam>+36301234567</telefonszam>
        <email>anna.kovacs@example.com</email>
    </ugyfel>
    
    <!-- Ügy-Re -->

    <ugyre megjegyzesid="1" rendelesid="10" ugyfelid="1">
        <megjegyzes>Kérem, minél hamarabb szállítsák ki a terméket!</megjegyzes>
    </ugyre>

    <!-- Rendelések -->

    <rendeles fizetestipusa="online" rendelesid="1" statusz="fizetésre vár" szallitoid="3" ugyfelid="11">
        <osszeg>7067.46</osszeg>
        <datum>2023-03-15</datum>
    </rendeles>

    <!-- Rendelt Termékek -->

    <rendelttermek rendelesid="5" rendelttermekid="1" termekid="3">
        <egysegar>1899.50</egysegar>
        <afa>27%</afa>
        <mennyiseg>4</mennyiseg>
    </rendelttermek>

    <!-- Termékek -->

    <termek akcios="nem" termekid="1">
        <nev>Laptop Dell XPS 13</nev>
        <ar>2799.99</ar>
    </termek>

    <!-- Szállítók -->

    <szallito szallitoid="1">
        <nev>Express Shipping Kft.</nev>
        <telefonszam>+36301234567</telefonszam>
        <szallitasiar>500.00</szallitasiar>
        <kozpontcime>
            <iranyitoszam>1055</iranyitoszam>
            <varos>Budapest</varos>
            <kozterneve>Váci út</kozterneve>
            <hazszam>22</hazszam>
        </kozpontcime>
    </szallito>

</webshop>